{
  "schemaVersion": 1,
  "notes": "Source snapshot of 35 agents registered by teammate agency_research (31) and agency_tov (4). Registration is not execution proof. Known standalone ToV production entry gaps remain explicit. Code-only publication preparation/closure are not missing agents; sending remains disabled. agency_operations orchestration agents are outside this initial teammate inventory. Refresh source mapping when teammate definitions change.",
  "agents": [
    {
      "id": "agency_research.page_extractor",
      "processId": "agency_operations.analysis.v1",
      "source": "ai-company/apps/mercato/src/modules/agency_research/lib/agents/sources.ts",
      "connection": "connected",
      "entry": "ai-company/apps/mercato/src/modules/agency_research/lib/research/steps/sources.ts",
      "handoff": "ai-company/apps/mercato/src/modules/agency_research/lib/research/steps/audit.ts",
      "integrationIds": [
        "research-sources-to-audit"
      ]
    },
    {
      "id": "agency_research.proof_builder",
      "processId": "agency_operations.analysis.v1",
      "source": "ai-company/apps/mercato/src/modules/agency_research/lib/agents/sources.ts",
      "connection": "connected",
      "entry": "ai-company/apps/mercato/src/modules/agency_research/lib/research/steps/sources.ts",
      "handoff": "ai-company/apps/mercato/src/modules/agency_research/lib/research/steps/audit.ts",
      "integrationIds": [
        "research-sources-to-audit"
      ]
    },
    {
      "id": "agency_research.content_seeder",
      "processId": "agency_operations.analysis.v1",
      "source": "ai-company/apps/mercato/src/modules/agency_research/lib/agents/sources.ts",
      "connection": "connected",
      "entry": "ai-company/apps/mercato/src/modules/agency_research/lib/research/steps/sources.ts",
      "handoff": "ai-company/apps/mercato/src/modules/agency_research/lib/research/steps/audit.ts",
      "integrationIds": [
        "research-sources-to-audit"
      ]
    },
    {
      "id": "agency_research.conflict_finder",
      "processId": "agency_operations.analysis.v1",
      "source": "ai-company/apps/mercato/src/modules/agency_research/lib/agents/sources.ts",
      "connection": "connected",
      "entry": "ai-company/apps/mercato/src/modules/agency_research/lib/research/steps/sources.ts",
      "handoff": "ai-company/apps/mercato/src/modules/agency_research/lib/research/steps/audit.ts",
      "integrationIds": [
        "research-sources-to-audit"
      ]
    },
    {
      "id": "agency_research.coverage_assessor",
      "processId": "agency_operations.analysis.v1",
      "source": "ai-company/apps/mercato/src/modules/agency_research/lib/agents/sources.ts",
      "connection": "connected",
      "entry": "ai-company/apps/mercato/src/modules/agency_research/lib/research/steps/sources.ts",
      "handoff": "ai-company/apps/mercato/src/modules/agency_research/lib/research/steps/audit.ts",
      "integrationIds": [
        "research-sources-to-audit"
      ]
    },
    {
      "id": "agency_research.audit_mapper",
      "processId": "agency_operations.analysis.v1",
      "source": "ai-company/apps/mercato/src/modules/agency_research/lib/agents/audit.ts",
      "connection": "connected",
      "entry": "ai-company/apps/mercato/src/modules/agency_research/lib/research/steps/audit.ts",
      "handoff": "ai-company/apps/mercato/src/modules/agency_research/lib/research/steps/findings.ts",
      "integrationIds": [
        "research-audit-to-findings"
      ]
    },
    {
      "id": "agency_research.audit_voice",
      "processId": "agency_operations.analysis.v1",
      "source": "ai-company/apps/mercato/src/modules/agency_research/lib/agents/audit.ts",
      "connection": "connected",
      "entry": "ai-company/apps/mercato/src/modules/agency_research/lib/research/steps/audit.ts",
      "handoff": "ai-company/apps/mercato/src/modules/agency_research/lib/research/steps/findings.ts",
      "integrationIds": [
        "research-audit-to-findings"
      ]
    },
    {
      "id": "agency_research.audit_gaps_assets",
      "processId": "agency_operations.analysis.v1",
      "source": "ai-company/apps/mercato/src/modules/agency_research/lib/agents/audit.ts",
      "connection": "connected",
      "entry": "ai-company/apps/mercato/src/modules/agency_research/lib/research/steps/audit.ts",
      "handoff": "ai-company/apps/mercato/src/modules/agency_research/lib/research/steps/findings.ts",
      "integrationIds": [
        "research-audit-to-findings"
      ]
    },
    {
      "id": "agency_research.competitor_selector",
      "processId": "agency_operations.analysis.v1",
      "source": "ai-company/apps/mercato/src/modules/agency_research/lib/agents/competitors.ts",
      "connection": "connected",
      "entry": "ai-company/apps/mercato/src/modules/agency_research/lib/research/steps/competitors.ts",
      "handoff": "ai-company/apps/mercato/src/modules/agency_research/lib/research/steps/findings.ts",
      "integrationIds": [
        "research-competitors-to-findings"
      ]
    },
    {
      "id": "agency_research.competitor_card",
      "processId": "agency_operations.analysis.v1",
      "source": "ai-company/apps/mercato/src/modules/agency_research/lib/agents/competitors.ts",
      "connection": "connected",
      "entry": "ai-company/apps/mercato/src/modules/agency_research/lib/research/steps/competitors.ts",
      "handoff": "ai-company/apps/mercato/src/modules/agency_research/lib/research/steps/findings.ts",
      "integrationIds": [
        "research-competitors-to-findings"
      ]
    },
    {
      "id": "agency_research.competitor_channels",
      "processId": "agency_operations.analysis.v1",
      "source": "ai-company/apps/mercato/src/modules/agency_research/lib/agents/competitors.ts",
      "connection": "connected",
      "entry": "ai-company/apps/mercato/src/modules/agency_research/lib/research/steps/competitors.ts",
      "handoff": "ai-company/apps/mercato/src/modules/agency_research/lib/research/steps/findings.ts",
      "integrationIds": [
        "research-competitors-to-findings"
      ]
    },
    {
      "id": "agency_research.competitor_synthesizer",
      "processId": "agency_operations.analysis.v1",
      "source": "ai-company/apps/mercato/src/modules/agency_research/lib/agents/competitors.ts",
      "connection": "connected",
      "entry": "ai-company/apps/mercato/src/modules/agency_research/lib/research/steps/competitors.ts",
      "handoff": "ai-company/apps/mercato/src/modules/agency_research/lib/research/steps/findings.ts",
      "integrationIds": [
        "research-competitors-to-findings"
      ]
    },
    {
      "id": "agency_research.field_mapper",
      "processId": "agency_operations.analysis.v1",
      "source": "ai-company/apps/mercato/src/modules/agency_research/lib/agents/findings.ts",
      "connection": "connected",
      "entry": "ai-company/apps/mercato/src/modules/agency_research/lib/research/steps/findings.ts",
      "handoff": "ai-company/apps/mercato/src/modules/agency_research/lib/research/steps/brief.ts",
      "integrationIds": [
        "research-findings-to-brief"
      ]
    },
    {
      "id": "agency_research.question_writer",
      "processId": "agency_operations.analysis.v1",
      "source": "ai-company/apps/mercato/src/modules/agency_research/lib/agents/findings.ts",
      "connection": "connected",
      "entry": "ai-company/apps/mercato/src/modules/agency_research/lib/research/steps/findings.ts",
      "handoff": "ai-company/apps/mercato/src/modules/agency_research/lib/research/steps/brief.ts",
      "integrationIds": [
        "research-findings-to-brief"
      ]
    },
    {
      "id": "agency_research.readiness_assessor",
      "processId": "agency_operations.analysis.v1",
      "source": "ai-company/apps/mercato/src/modules/agency_research/lib/agents/findings.ts",
      "connection": "connected",
      "entry": "ai-company/apps/mercato/src/modules/agency_research/lib/research/steps/findings.ts",
      "handoff": "ai-company/apps/mercato/src/modules/agency_research/lib/research/steps/brief.ts",
      "integrationIds": [
        "research-findings-to-brief"
      ]
    },
    {
      "id": "agency_research.research_qa",
      "processId": "agency_operations.analysis.v1",
      "source": "ai-company/apps/mercato/src/modules/agency_research/lib/agents/findings.ts",
      "connection": "connected",
      "entry": "ai-company/apps/mercato/src/modules/agency_research/lib/research/steps/findings.ts",
      "handoff": "ai-company/apps/mercato/src/modules/agency_research/lib/research/steps/brief.ts",
      "integrationIds": [
        "research-findings-to-brief"
      ]
    },
    {
      "id": "agency_research.brief_writer.offer_audience_direction",
      "processId": "agency_operations.analysis.v1",
      "source": "ai-company/apps/mercato/src/modules/agency_research/lib/agents/brief.ts",
      "connection": "connected",
      "entry": "ai-company/apps/mercato/src/modules/agency_research/lib/research/steps/brief.ts",
      "handoff": "ai-company/apps/mercato/src/modules/agency_operations/lib/analysisProcess/briefReviewHandoff.ts",
      "integrationIds": [
        "research-brief-to-client-review"
      ]
    },
    {
      "id": "agency_research.brief_writer.promise_voice",
      "processId": "agency_operations.analysis.v1",
      "source": "ai-company/apps/mercato/src/modules/agency_research/lib/agents/brief.ts",
      "connection": "connected",
      "entry": "ai-company/apps/mercato/src/modules/agency_research/lib/research/steps/brief.ts",
      "handoff": "ai-company/apps/mercato/src/modules/agency_operations/lib/analysisProcess/briefReviewHandoff.ts",
      "integrationIds": [
        "research-brief-to-client-review"
      ]
    },
    {
      "id": "agency_research.brief_writer.channel_success_assets",
      "processId": "agency_operations.analysis.v1",
      "source": "ai-company/apps/mercato/src/modules/agency_research/lib/agents/brief.ts",